{
 "schema": "cpb-register-v1",
 "register": "review-unit-ledger",
 "title": "H001 Horizon Review Unit Ledger",
 "scope": "lane",
 "horizon": "H001",
 "meta": {
  "purpose": "Durable review-unit publication, merge, waiver, and supersession evidence for one horizon."
 },
 "columns": [
  "review_unit_id",
  "boundary_type",
  "phase_ids",
  "status",
  "review_artifact",
  "publication_commit_sha",
  "merge_commit_sha",
  "supersedes_notes"
 ],
 "entries": [],
 "change_log": [
  {
   "date": "YYYY-MM-DD",
   "entry": "Review-unit ledger initialized at horizon admission."
  }
 ]
}
